sentence,relation,head,tail,head_offset,tail_offset
子节点是斐波那契堆的重要属性,b-attr,子节点,斐波那契堆,0,4
在算法中，穷举法和线性结构执行相反的功能,anto,穷举法,线性结构,5,9
实现非连通图时需要依赖边,rely,非连通图,边,2,11
在数据结构中，不相交集合和非比较排序表示相同的概念,syno,不相交集合,非比较排序,7,13
实现最优子结构时需要依赖入队,b-rely,入队,最优子结构,12,2
树的深度是散列表的组成部分,b-belg,树的深度,散列表,0,5
最坏情况由邻接多重表等部分构成,b-belg,邻接多重表,最坏情况,5,0
冲突解决与内存回收具有相反的作用,anto,冲突解决,内存回收,0,5
摊还分析具有后缀数组属性,b-attr,后缀数组,摊还分析,6,0
分割由AOV网等部分构成,belg,分割,AOV网,0,3
散列文件和合并是对立的概念,anto,散列文件,合并,0,5
顺序存储和入栈是相反的操作,anto,顺序存储,入栈,0,5
表尾与开放寻址具有相同的含义,syno,表尾,开放寻址,0,3
哈希表是平衡的重要属性,b-attr,哈希表,平衡,0,4
尾节点表现出无序表的特性,attr,尾节点,无序表,0,6
层序遍历的特征是深度优先搜索,b-attr,深度优先搜索,层序遍历,8,0
在稳定性中包含了递归,belg,稳定性,递归,1,8
静态内存是访问的重要属性,attr,访问,静态内存,5,0
线性表具有无向图属性,attr,线性表,无向图,0,5
哈希查找是散列存储的组成部分,belg,散列存储,哈希查找,5,0
链式存储表现出算法步骤的特性,attr,链式存储,算法步骤,0,7
路径压缩表现出更新的特性,b-attr,更新,路径压缩,7,0
实现表头时需要依赖满二叉树,rely,表头,满二叉树,2,9
并查集包含桶排序,b-belg,桶排序,并查集,5,0
动态规划与内存分配具有相同的含义,syno,动态规划,内存分配,0,5
在算法中，随机访问和堆内存执行相反的功能,anto,随机访问,堆内存,5,10
初始化的实现基于生成森林,rely,初始化,生成森林,0,8
斐波那契堆由满二叉树等部分构成,b-belg,满二叉树,斐波那契堆,6,0
静态数组表现出记忆化搜索的特性,b-attr,记忆化搜索,静态数组,7,0
在邻接多重表中包含了头节点,b-belg,头节点,邻接多重表,10,1
位序的实现基于动态规划入门,b-rely,动态规划入门,位序,7,0
插入表现出小根堆的特性,b-attr,小根堆,插入,5,0
内存回收包含边的权重,belg,内存回收,边的权重,0,6
有序表由稠密图等部分构成,belg,有序表,稠密图,0,4
二分查找依赖于顶点度数,b-rely,顶点度数,二分查找,7,0
抽象数据类型是强连通图的重要属性,b-attr,抽象数据类型,强连通图,0,7
克鲁斯卡尔算法具有出度属性,attr,克鲁斯卡尔算法,出度,0,9
内存池表现出后缀数组的特性,b-attr,后缀数组,内存池,6,0
二叉搜索树由负权回路等部分构成,belg,二叉搜索树,负权回路,0,6
邻接表具有数据项属性,b-attr,数据项,邻接表,5,0
LFU缓存的实现基于链地址法,rely,LFU缓存,链地址法,0,10
在LFU缓存中包含了有向图,belg,LFU缓存,有向图,1,10
堆内存与迭代法具有相同的含义,syno,堆内存,迭代法,0,4
实现稳定排序时需要依赖线性查找,rely,稳定排序,线性查找,2,11
散列表包含集合,b-belg,集合,散列表,5,0
父节点具有B+树属性,attr,父节点,B+树,0,5
树的深度需要使用队列,b-rely,队列,树的深度,8,0
大O记号是迪杰斯特拉算法的组成部分,b-belg,大O记号,迪杰斯特拉算法,0,5
实现引用时需要依赖外部排序,b-rely,外部排序,引用,9,2
内存回收包含普里姆算法,b-belg,普里姆算法,内存回收,6,0
顶点表现出Dijkstra算法的特性,b-attr,Dijkstra算法,顶点,5,0
实现入度时需要依赖小根堆,b-rely,小根堆,入度,9,2
在Floyd算法中包含了删除,belg,Floyd算法,删除,1,12
在数据结构中，Dijkstra算法和散列表表示相同的概念,syno,Dijkstra算法,散列表,7,18
实现贪心算法时需要依赖字典树,rely,贪心算法,字典树,2,11
AOE 网的实现基于内部排序,b-rely,内部排序,AOE 网,10,0
邻接表表现出后序遍历的特性,attr,邻接表,后序遍历,0,6
实现合并时需要依赖扩容,b-rely,扩容,合并,9,2
线性表的实现基于弱连通图,rely,线性表,弱连通图,0,8
Dijkstra算法和非比较排序是同义概念,syno,Dijkstra算法,非比较排序,0,11
前缀树由哈希函数等部分构成,belg,前缀树,哈希函数,0,4
扩容表现出数据项的特性,attr,扩容,数据项,0,5
KMP算法的特征是链式存储,b-attr,链式存储,KMP算法,9,0
在数据结构中，移动和折半查找表示相同的概念,syno,移动,折半查找,7,10
克鲁斯卡尔算法表现出迪杰斯特拉算法的特性,attr,克鲁斯卡尔算法,迪杰斯特拉算法,0,10
顺序查找表现出数据项的特性,attr,顺序查找,数据项,0,7
在入栈中包含了前驱节点,belg,入栈,前驱节点,1,7
在数据结构中，头节点和前驱节点表示相同的概念,syno,头节点,前驱节点,7,11
尾节点等同于入度,syno,尾节点,入度,0,6
记忆化搜索需要使用操作效率,b-rely,操作效率,记忆化搜索,9,0
引用表现出静态查找的特性,b-attr,静态查找,引用,5,0
深度优先搜索是左子树的重要属性,b-attr,深度优先搜索,左子树,0,7
在不稳定排序中包含了散列存储,belg,不稳定排序,散列存储,1,10
红黑树的实现基于旋转,b-rely,旋转,红黑树,8,0
更新依赖于插入排序,rely,更新,插入排序,0,5
AOE 网依赖于二路归并,b-rely,二路归并,AOE 网,8,0
贪心策略是头节点的重要属性,b-attr,贪心策略,头节点,0,5
AOV网的特征是AVL树,b-attr,AVL树,AOV网,8,0
非比较排序的实现基于十字链表,rely,非比较排序,十字链表,0,10
二叉树表现出生成森林的特性,attr,二叉树,生成森林,0,6
无序表的实现基于有序表,b-rely,有序表,无序表,8,0
在算法中，出队和度执行相反的功能,anto,出队,度,5,8
数组的特征是Ω记号,attr,数组,Ω记号,0,6
完全二叉树由穷举法等部分构成,belg,完全二叉树,穷举法,0,6
AC自动机表现出链表的特性,attr,AC自动机,链表,0,8
查找失败依赖于数据元素,b-rely,数据元素,查找失败,7,0
分块查找是操作效率的重要属性,attr,操作效率,分块查找,5,0
分块查找的特征是插值查找,attr,分块查找,插值查找,0,8
父节点需要使用有序序列,b-rely,有序序列,父节点,7,0
回溯法具有分治算法属性,b-attr,分治算法,回溯法,5,0
AC自动机与线性表具有相反的作用,anto,AC自动机,线性表,0,6
按秩合并包含平均情况,b-belg,平均情况,按秩合并,6,0
树表查找和最坏情况是相反的操作,anto,树表查找,最坏情况,0,5
在线段树中包含了线性表,belg,线段树,线性表,1,8
空间复杂度包含表长,belg,空间复杂度,表长,0,7
集合是无序表的组成部分,b-belg,集合,无序表,0,3
在希尔排序中包含了树表查找,b-belg,树表查找,希尔排序,9,1
静态内存和希尔排序是相反的操作,anto,静态内存,希尔排序,0,5
环的实现基于Dijkstra算法,rely,环,Dijkstra算法,0,6
非线性结构依赖于AOV 网,b-rely,AOV 网,非线性结构,8,0
抽象数据类型具有会计方法属性,b-attr,会计方法,抽象数据类型,8,0
无序表包含有序序列,b-belg,有序序列,无序表,5,0
后缀数组等同于Kruskal算法,syno,后缀数组,Kruskal算法,0,7
AOV网是小根堆的重要属性,b-attr,AOV网,小根堆,0,5
计数排序是路径压缩的组成部分,b-belg,计数排序,路径压缩,0,5
二路归并与树的高度具有相同的含义,syno,二路归并,树的高度,0,5
移动和Dijkstra算法是相反的操作,anto,移动,Dijkstra算法,0,3
外部排序由并查集等部分构成,b-belg,并查集,外部排序,5,0
单链表的实现基于大根堆,rely,单链表,大根堆,0,8
生成森林需要使用最优子结构,b-rely,最优子结构,生成森林,8,0
在可持久化数据结构中包含了出队,belg,可持久化数据结构,出队,1,13
线性结构包含表头,b-belg,表头,线性结构,6,0
时间复杂度与度具有相同的含义,syno,时间复杂度,度,0,4
移动需要使用B树,b-rely,B树,移动,6,0
树的度具有循环队列属性,attr,树的度,循环队列,0,5
双端队列是堆内存的组成部分,b-belg,双端队列,堆内存,0,5
迭代需要使用图的顶点,rely,迭代,图的顶点,0,6
折半查找的实现基于动态规划,rely,折半查找,动态规划,0,9
小根堆是Floyd算法的重要属性,b-attr,小根堆,Floyd算法,0,4
循环链表的特征是树表查找,b-attr,树表查找,循环链表,8,0
在算法中，队列和无序序列执行相反的功能,anto,队列,无序序列,5,8
非连通图是树的高度的组成部分,b-belg,非连通图,树的高度,0,5
右子树的特征是复制,b-attr,复制,右子树,7,0
在计数排序中包含了栈,b-belg,栈,计数排序,9,1
动态数组包含邻接矩阵,b-belg,邻接矩阵,动态数组,6,0
平衡因子依赖于稠密图,b-rely,稠密图,平衡因子,7,0
在动态规划入门中包含了B树,belg,动态规划入门,B树,1,11
函数式数据结构和入队是相反的操作,anto,函数式数据结构,入队,0,8
斐波那契堆的实现基于多源最短路径,b-rely,多源最短路径,斐波那契堆,10,0
希尔排序需要使用遍历,rely,希尔排序,遍历,0,8
在折半查找中包含了引用,belg,折半查找,引用,1,9
复制包含无序序列,belg,复制,无序序列,0,4
全局最优包含内存回收,belg,全局最优,内存回收,0,6
邻接多重表和穷举法是相反的操作,anto,邻接多重表,穷举法,0,6
回溯法包含动态规划入门,b-belg,动态规划入门,回溯法,5,0
路径的实现基于折半查找,b-rely,折半查找,路径,7,0
分块查找依赖于单链表,rely,分块查找,单链表,0,7
希尔排序是内部节点的重要属性,b-attr,希尔排序,内部节点,0,5
在二项堆中包含了抽象数据类型,belg,二项堆,抽象数据类型,1,8
记忆化搜索具有树的度属性,b-attr,树的度,记忆化搜索,7,0
算法步骤是缩容的重要属性,attr,缩容,算法步骤,5,0
平衡需要使用Kruskal算法,rely,平衡,Kruskal算法,0,6
数据项需要使用B树,b-rely,B树,数据项,7,0
树和边是相反的操作,anto,树,边,0,2
后缀树具有父节点属性,attr,后缀树,父节点,0,5
连通分量与无序序列具有相反的作用,anto,连通分量,无序序列,0,5
有向图是拓扑排序的组成部分,b-belg,有向图,拓扑排序,0,4
Kruskal算法需要使用静态内存,b-rely,静态内存,Kruskal算法,13,0
实现贪心选择性质时需要依赖原地排序,rely,贪心选择性质,原地排序,2,13
插入排序需要使用数据项,b-rely,数据项,插入排序,8,0
内存分配依赖于跳跃表,rely,内存分配,跳跃表,0,7
原地排序和单链表是相反的操作,anto,原地排序,单链表,0,5
算法的可行性与贪心策略具有相反的作用,anto,算法的可行性,贪心策略,0,7
图的顶点具有记忆化搜索属性,b-attr,记忆化搜索,图的顶点,6,0
字典树表现出状态转移的特性,b-attr,状态转移,字典树,6,0
动态数组等同于平衡因子,syno,动态数组,平衡因子,0,7
函数式数据结构需要使用内存分配,b-rely,内存分配,函数式数据结构,11,0
表头表现出平衡二叉树的特性,b-attr,平衡二叉树,表头,5,0
空间复杂度等同于邻接矩阵,syno,空间复杂度,邻接矩阵,0,8
栈需要使用平衡二叉树,rely,栈,平衡二叉树,0,5
状态转移需要使用快速排序,b-rely,快速排序,状态转移,8,0
双向链表的实现基于不相交集合,rely,双向链表,不相交集合,0,9
在迭代中包含了删除,belg,迭代,删除,1,7
最长路径是线性表的组成部分,b-belg,最长路径,线性表,0,5
最坏情况依赖于冒泡排序,rely,最坏情况,冒泡排序,0,7
实现时间复杂度时需要依赖最长路径,rely,时间复杂度,最长路径,2,12
头节点由最优子结构等部分构成,belg,头节点,最优子结构,0,4
跳跃表和强连通分量是相反的操作,anto,跳跃表,强连通分量,0,4
满二叉树的特征是冒泡排序,b-attr,冒泡排序,满二叉树,8,0
时间复杂度由树等部分构成,b-belg,树,时间复杂度,6,0
加权图具有非连通图属性,attr,加权图,非连通图,0,5
弱连通图依赖于指针,b-rely,指针,弱连通图,7,0
最短路径包含完全二叉树,belg,最短路径,完全二叉树,0,6
分治的实现基于根节点,rely,分治,根节点,0,7
在算法中，全局最优和大O记号执行相反的功能,anto,全局最优,大O记号,5,10
索引存储需要使用最优子结构,b-rely,最优子结构,索引存储,8,0
图由满二叉树等部分构成,b-belg,满二叉树,图,2,0
广度优先搜索和大根堆是同义概念,syno,广度优先搜索,大根堆,0,7
合并具有前缀树属性,attr,合并,前缀树,0,4
出栈包含局部最优,belg,出栈,局部最优,0,4
Floyd算法是动态查找的重要属性,b-attr,Floyd算法,动态查找,0,8
非比较排序包含双端队列,b-belg,双端队列,非比较排序,7,0
在非线性结构中包含了原地排序,belg,非线性结构,原地排序,1,10
回溯法的特征是静态数组,b-attr,静态数组,回溯法,7,0
直接插入排序等同于Dijkstra算法,syno,直接插入排序,Dijkstra算法,0,9
查找成功表现出跳跃表的特性,b-attr,跳跃表,查找成功,7,0
实现连通图时需要依赖顶点度数,b-rely,顶点度数,连通图,10,2
尾节点与静态查找具有相同的含义,syno,尾节点,静态查找,0,4
贪心策略由最优子结构等部分构成,belg,贪心策略,最优子结构,0,5
静态查找与邻接表具有相同的含义,syno,静态查找,邻接表,0,5
实现扩容时需要依赖访问,b-rely,访问,扩容,9,2
堆内存等同于图,syno,堆内存,图,0,6
更新的特征是原地排序,attr,更新,原地排序,0,6
后缀数组等同于插入,syno,后缀数组,插入,0,7
边的方向与完全二叉树具有相同的含义,syno,边的方向,完全二叉树,0,5
负权边的实现基于算法步骤,b-rely,算法步骤,负权边,8,0
叶子节点的实现基于字符串,b-rely,字符串,叶子节点,9,0
插入的特征是动态规划入门,b-attr,动态规划入门,插入,6,0
边和顶点是对立的概念,anto,边,顶点,0,2
查找成功的实现基于可持久化数据结构,b-rely,可持久化数据结构,查找成功,9,0
静态查找的特征是普里姆算法,attr,静态查找,普里姆算法,0,8
删除由弱连通图等部分构成,b-belg,弱连通图,删除,3,0
二项堆包含树的度,belg,二项堆,树的度,0,5
AOV网依赖于普里姆算法,b-rely,普里姆算法,AOV网,7,0
最好情况需要使用遍历,rely,最好情况,遍历,0,8
递归基础依赖于线性结构,rely,递归基础,线性结构,0,7
递归复杂度依赖于按秩合并,b-rely,按秩合并,递归复杂度,8,0
平衡是链表的组成部分,b-belg,平衡,链表,0,3
头节点表现出边的方向的特性,b-attr,边的方向,头节点,6,0
中序遍历依赖于斐波那契堆,b-rely,斐波那契堆,中序遍历,7,0
链表依赖于旋转,b-rely,旋转,链表,5,0
在数据结构中，LRU缓存和抽象数据类型表示相同的概念,syno,LRU缓存,抽象数据类型,7,13
冒泡排序是选择排序的重要属性,attr,选择排序,冒泡排序,5,0
连通图具有散列文件属性,b-attr,散列文件,连通图,5,0
动态规划由扩容等部分构成,belg,动态规划,扩容,0,5
跳跃表是顺序查找的组成部分,b-belg,跳跃表,顺序查找,0,4
随机访问具有引用属性,attr,随机访问,引用,0,6
直接插入排序是顺序存储的重要属性,b-attr,直接插入排序,顺序存储,0,7
右子树包含循环链表,b-belg,循环链表,右子树,5,0
穷举法的特征是开放寻址,b-attr,开放寻址,穷举法,7,0
KMP算法的实现基于空间复杂度,rely,KMP算法,空间复杂度,0,10
外部排序由斐波那契堆等部分构成,b-belg,斐波那契堆,外部排序,5,0
加权图的实现基于后继节点,rely,加权图,后继节点,0,8
AOE网表现出回路的特性,attr,AOE网,回路,0,7
二叉树由分支限界等部分构成,b-belg,分支限界,二叉树,4,0
合并与出栈具有相反的作用,anto,合并,出栈,0,3
在内存池中包含了大根堆,b-belg,大根堆,内存池,8,1
实现非线性结构时需要依赖排序,b-rely,排序,非线性结构,12,2
在算法中，不相交集合和散列文件执行相反的功能,anto,不相交集合,散列文件,5,11
在数据结构中，二叉搜索树和销毁表示相同的概念,syno,二叉搜索树,销毁,7,13
实现递归时需要依赖B+树,rely,递归,B+树,2,9
双向链表与按秩合并具有相反的作用,anto,双向链表,按秩合并,0,5
插入和链表节点是对立的概念,anto,插入,链表节点,0,3
桶排序具有对象池属性,attr,桶排序,对象池,0,5
Ω记号和线段树是同义概念,syno,Ω记号,线段树,0,4
二路归并与静态数组具有相同的含义,syno,二路归并,静态数组,0,5
时间复杂度与记忆化搜索具有相同的含义,syno,时间复杂度,记忆化搜索,0,6
回溯算法表现出静态数组的特性,attr,回溯算法,静态数组,0,7
树的高度具有顺序查找属性,attr,树的高度,顺序查找,0,6
后缀数组的特征是初始化,attr,后缀数组,初始化,0,8
AVL树等同于负权边,syno,AVL树,负权边,0,7
实现非线性结构时需要依赖度,rely,非线性结构,度,2,12
静态数组具有前驱节点属性,b-attr,前驱节点,静态数组,6,0
堆排序需要使用遍历,rely,堆排序,遍历,0,7
在邻接表中包含了克鲁斯卡尔算法,b-belg,克鲁斯卡尔算法,邻接表,8,1
图需要使用按秩合并,rely,图,按秩合并,0,5
连通分量需要使用线性查找,rely,连通分量,线性查找,0,8
查找成功是可持久化数据结构的重要属性,b-attr,查找成功,可持久化数据结构,0,5
线性结构是入栈的重要属性,attr,入栈,线性结构,5,0
可持久化数据结构由左子树等部分构成,belg,可持久化数据结构,左子树,0,9
顺序存储是外部排序的组成部分,belg,外部排序,顺序存储,5,0
在局部最优中包含了指数查找,b-belg,指数查找,局部最优,9,1
左子树和物理结构是对立的概念,anto,左子树,物理结构,0,4
算法的确定性的特征是聚合分析,b-attr,聚合分析,算法的确定性,10,0
插入排序由B树等部分构成,b-belg,B树,插入排序,5,0
插值查找是稀疏图的重要属性,attr,稀疏图,插值查找,5,0
图由尾节点等部分构成,b-belg,尾节点,图,2,0
全局最优是满二叉树的组成部分,belg,满二叉树,全局最优,5,0
贪心的特征是边的权重,b-attr,边的权重,贪心,6,0
贪心策略和出栈是同义概念,syno,贪心策略,出栈,0,5
Θ记号的特征是最小生成树,attr,Θ记号,最小生成树,0,7
分支限界和Dijkstra算法是对立的概念,anto,分支限界,Dijkstra算法,0,5
关键路径的特征是递推,attr,关键路径,递推,0,8
线段树表现出静态内存的特性,b-attr,静态内存,线段树,6,0
算法的有穷性表现出关键路径的特性,attr,算法的有穷性,关键路径,0,9
稳定排序由二路归并等部分构成,b-belg,二路归并,稳定排序,5,0
关键路径需要使用数据元素,rely,关键路径,数据元素,0,8
多路归并与拓扑排序具有相反的作用,anto,多路归并,拓扑排序,0,5
字典树是初始化的重要属性,attr,初始化,字典树,4,0
图的顶点是图的边的重要属性,attr,图的边,图的顶点,5,0
B+树的特征是二叉树,b-attr,二叉树,B+树,7,0
后缀数组是指数查找的重要属性,attr,指数查找,后缀数组,5,0
队列包含查找失败,b-belg,查找失败,队列,4,0
双向链表需要使用强连通分量,rely,双向链表,强连通分量,0,8
Kruskal算法具有二项堆属性,attr,Kruskal算法,二项堆,0,11
顺序查找的实现基于插入排序,rely,顺序查找,插入排序,0,9
冒泡排序表现出稳定排序的特性,b-attr,稳定排序,冒泡排序,7,0
冲突解决表现出开放寻址的特性,b-attr,开放寻址,冲突解决,7,0
二项堆的实现基于稳定性,b-rely,稳定性,二项堆,8,0
引用计数由排序等部分构成,b-belg,排序,引用计数,5,0
在算法的有穷性中包含了外部排序,belg,算法的有穷性,外部排序,1,11
二项堆是平均情况的组成部分,b-belg,二项堆,平均情况,0,4
冲突解决是AVL树的组成部分,b-belg,冲突解决,AVL树,0,5
斐波那契堆和算法步骤是相反的操作,anto,斐波那契堆,算法步骤,0,6
稠密图是头节点的重要属性,b-attr,稠密图,头节点,0,4
操作效率依赖于大O记号,b-rely,大O记号,操作效率,7,0
图包含时间复杂度,b-belg,时间复杂度,图,3,0
动态规划与递归具有相反的作用,anto,动态规划,递归,0,5
多源最短路径具有平衡因子属性,attr,多源最短路径,平衡因子,0,8
桶排序包含AOE 网,b-belg,AOE 网,桶排序,5,0
索引存储和顶点度数是对立的概念,anto,索引存储,顶点度数,0,5
Prim算法与树的度具有相同的含义,syno,Prim算法,树的度,0,7
原地排序由大根堆等部分构成,belg,原地排序,大根堆,0,5
基数排序是回溯法的组成部分,belg,回溯法,基数排序,5,0
图是引用计数的重要属性,attr,引用计数,图,2,0
简单排序和冲突解决是同义概念,syno,简单排序,冲突解决,0,5
索引存储的特征是平衡因子,b-attr,平衡因子,索引存储,8,0
最坏情况包含树,b-belg,树,最坏情况,6,0
堆内存需要使用线性查找,b-rely,线性查找,堆内存,7,0
函数式数据结构表现出外部排序的特性,b-attr,外部排序,函数式数据结构,10,0
小根堆包含邻接表,belg,小根堆,邻接表,0,5
迭代与强连通图具有相反的作用,anto,迭代,强连通图,0,3
平均情况依赖于优先队列,b-rely,优先队列,平均情况,7,0
栈和状态转移是相反的操作,anto,栈,状态转移,0,2
无向图依赖于前缀树,b-rely,前缀树,无向图,6,0
循环链表表现出有序序列的特性,b-attr,有序序列,循环链表,7,0
遍历与入队具有相同的含义,syno,遍历,入队,0,3
中序遍历是Dijkstra算法的组成部分,b-belg,中序遍历,Dijkstra算法,0,5
在局部最优中包含了入队,b-belg,入队,局部最优,9,1
在前驱节点中包含了对象池,belg,前驱节点,对象池,1,9
度与图的边具有相反的作用,anto,度,图的边,0,2
引用需要使用树表查找,rely,引用,树表查找,0,6
递归复杂度的特征是空间复杂度,attr,递归复杂度,空间复杂度,0,9
尾节点的实现基于邻接多重表,rely,尾节点,邻接多重表,0,8
垃圾回收由斐波那契堆等部分构成,b-belg,斐波那契堆,垃圾回收,5,0
字符串和LRU缓存是对立的概念,anto,字符串,LRU缓存,0,4
连通图的实现基于递推,b-rely,递推,连通图,8,0
算法的有穷性的特征是移动,b-attr,移动,算法的有穷性,10,0
在后缀数组中包含了贪心算法,belg,后缀数组,贪心算法,1,9
父节点包含Kruskal算法,b-belg,Kruskal算法,父节点,5,0
哈希表是字符串的组成部分,b-belg,哈希表,字符串,0,4
实现加权图时需要依赖子节点,rely,加权图,子节点,2,10
出栈表现出随机访问的特性,attr,出栈,随机访问,0,5
在算法中，最短路径和单源最短路径执行相反的功能,anto,最短路径,单源最短路径,5,10
空间复杂度的实现基于跳跃表,b-rely,跳跃表,空间复杂度,10,0
度具有冲突解决属性,b-attr,冲突解决,度,3,0
散列表和线段树是对立的概念,anto,散列表,线段树,0,4
可持久化数据结构依赖于稀疏图,b-rely,稀疏图,可持久化数据结构,11,0
实现动态查找时需要依赖链表节点,rely,动态查找,链表节点,2,11
旋转与分治算法具有相反的作用,anto,旋转,分治算法,0,3
希尔排序与算法的可行性具有相反的作用,anto,希尔排序,算法的可行性,0,5
表头表现出树的度的特性,b-attr,树的度,表头,5,0
表尾的实现基于非比较排序,rely,表尾,非比较排序,0,7
静态查找依赖于交换排序,rely,静态查找,交换排序,0,7
AOV网由树状数组等部分构成,belg,AOV网,树状数组,0,5
在最坏情况中包含了算法的确定性,b-belg,算法的确定性,最坏情况,9,1
状态转移具有物理结构属性,attr,状态转移,物理结构,0,6
最长路径由邻接表等部分构成,b-belg,邻接表,最长路径,5,0
入队包含逻辑结构,b-belg,逻辑结构,入队,4,0
有序表包含前序遍历,belg,有序表,前序遍历,0,5
后序遍历表现出哈希函数的特性,b-attr,哈希函数,后序遍历,7,0
索引存储和算法的有穷性是对立的概念,anto,索引存储,算法的有穷性,0,5
在数据结构中，算法的确定性和并查集表示相同的概念,syno,算法的确定性,并查集,7,14
递归和静态内存是相反的操作,anto,递归,静态内存,0,3
简单排序和队列是相反的操作,anto,简单排序,队列,0,5
物理结构包含优先队列,belg,物理结构,优先队列,0,6
在无向图中包含了内存分配,belg,无向图,内存分配,1,8
分支限界需要使用Θ记号,b-rely,Θ记号,分支限界,8,0
指针包含后序遍历,b-belg,后序遍历,指针,4,0
内存池具有字典树属性,attr,内存池,字典树,0,5
分治算法是集合的重要属性,attr,集合,分治算法,5,0
位序依赖于Ω记号,rely,位序,Ω记号,0,5
开放寻址是单链表的重要属性,b-attr,开放寻址,单链表,0,5
后缀数组由邻接多重表等部分构成,belg,后缀数组,邻接多重表,0,5
