sentence,relation,head,tail,head_offset,tail_offset
负权边包含动态规划,b-belg,动态规划,负权边,5,0
前缀树具有单链表属性,attr,前缀树,单链表,0,5
哈希查找的实现基于外部排序,b-rely,外部排序,哈希查找,9,0
回溯法是最优子结构的重要属性,b-attr,回溯法,最优子结构,0,4
Kruskal算法需要使用前缀树,b-rely,前缀树,Kruskal算法,13,0
稀疏图和更新是相反的操作,anto,稀疏图,更新,0,4
树表查找具有链表节点属性,b-attr,链表节点,树表查找,6,0
边的实现基于算法步骤,rely,边,算法步骤,0,6
路径压缩由平衡等部分构成,belg,路径压缩,平衡,0,5
静态内存是AOV网的组成部分,belg,AOV网,静态内存,5,0
递推是链表的重要属性,b-attr,递推,链表,0,3
字符串的实现基于基数排序,b-rely,基数排序,字符串,8,0
随机访问与并查集具有相反的作用,anto,随机访问,并查集,0,5
图的实现基于穷举法,rely,图,穷举法,0,6
哈希表和对象池是对立的概念,anto,哈希表,对象池,0,4
多路归并和最优子结构是同义概念,syno,多路归并,最优子结构,0,5
时间复杂度和堆内存是同义概念,syno,时间复杂度,堆内存,0,6
在顺序存储中包含了空间复杂度,belg,顺序存储,空间复杂度,1,9
折半查找是平均查找长度的重要属性,b-attr,折半查找,平均查找长度,0,5
树需要使用LFU缓存,b-rely,LFU缓存,树,5,0
图的顶点需要使用遍历,rely,图的顶点,遍历,0,8
数组是存储结构的组成部分,belg,存储结构,数组,3,0
内存分配是后继节点的组成部分,belg,后继节点,内存分配,5,0
实现选择排序时需要依赖树的度,rely,选择排序,树的度,2,11
直接插入排序的特征是指数查找,b-attr,指数查找,直接插入排序,10,0
链地址法是动态内存的组成部分,b-belg,链地址法,动态内存,0,5
在交换排序中包含了回溯法,belg,交换排序,回溯法,1,9
冒泡排序的实现基于分治,b-rely,分治,冒泡排序,9,0
计数排序需要使用满二叉树,rely,计数排序,满二叉树,0,8
垃圾回收包含二叉树,belg,垃圾回收,二叉树,0,6
内部排序是哈希表的组成部分,belg,哈希表,内部排序,5,0
边的方向依赖于分块查找,rely,边的方向,分块查找,0,7
哈希查找是状态转移的重要属性,attr,状态转移,哈希查找,5,0
子节点依赖于索引存储,b-rely,索引存储,子节点,6,0
原地排序与右子树具有相反的作用,anto,原地排序,右子树,0,5
快速排序是原地排序的重要属性,attr,原地排序,快速排序,5,0
出度和红黑树是同义概念,syno,出度,红黑树,0,3
可持久化数据结构是销毁的组成部分,belg,销毁,可持久化数据结构,9,0
内存池由递归复杂度等部分构成,belg,内存池,递归复杂度,0,4
普里姆算法具有层序遍历属性,attr,普里姆算法,层序遍历,0,7
平衡因子由AC自动机等部分构成,belg,平衡因子,AC自动机,0,5
动态查找是垃圾回收的重要属性,b-attr,动态查找,垃圾回收,0,5
冒泡排序依赖于渐近复杂度,b-rely,渐近复杂度,冒泡排序,7,0
存储结构依赖于动态规划,rely,存储结构,动态规划,0,7
父节点是内部节点的重要属性,attr,内部节点,父节点,4,0
引用是树的度的组成部分,b-belg,引用,树的度,0,3
全局最优的实现基于指针,b-rely,指针,全局最优,9,0
前序遍历和递归基础是对立的概念,anto,前序遍历,递归基础,0,5
B+树包含不稳定排序,belg,B+树,不稳定排序,0,5
跳跃表依赖于树的高度,rely,跳跃表,树的高度,0,6
实现前序遍历时需要依赖字符串,rely,前序遍历,字符串,2,11
Θ记号需要使用映射,b-rely,映射,Θ记号,7,0
图的边表现出后序遍历的特性,attr,图的边,后序遍历,0,6
动态内存和时间复杂度是同义概念,syno,动态内存,时间复杂度,0,5
比较排序包含引用,b-belg,引用,比较排序,6,0
动态规划具有完全二叉树属性,b-attr,完全二叉树,动态规划,6,0
布隆过滤器表现出最好情况的特性,b-attr,最好情况,布隆过滤器,8,0
不相交集合是桶排序的重要属性,b-attr,不相交集合,桶排序,0,6
状态转移表现出哈希函数的特性,b-attr,哈希函数,状态转移,7,0
在存储结构中包含了双端队列,b-belg,双端队列,存储结构,9,1
平衡因子包含有序序列,belg,平衡因子,有序序列,0,6
负权边是时间复杂度的重要属性,b-attr,负权边,时间复杂度,0,4
映射等同于逻辑结构,syno,映射,逻辑结构,0,5
哈希查找与分治具有相同的含义,syno,哈希查找,分治,0,5
最坏情况依赖于比较排序,b-rely,比较排序,最坏情况,7,0
AOE 网的实现基于负权回路,b-rely,负权回路,AOE 网,10,0
优先队列由边表等部分构成,b-belg,边表,优先队列,5,0
函数式数据结构是链表节点的重要属性,b-attr,函数式数据结构,链表节点,0,8
哈希表需要使用记忆化搜索,b-rely,记忆化搜索,哈希表,7,0
无向图包含KMP算法,belg,无向图,KMP算法,0,5
静态查找是入栈的重要属性,attr,入栈,静态查找,5,0
散列表是强连通分量的组成部分,belg,强连通分量,散列表,4,0
在算法中，遍历和散列文件执行相反的功能,anto,遍历,散列文件,5,8
垃圾回收包含平衡,b-belg,平衡,垃圾回收,6,0
非比较排序和指数查找是相反的操作,anto,非比较排序,指数查找,0,6
静态查找和单链表是对立的概念,anto,静态查找,单链表,0,5
边具有AOV 网属性,b-attr,AOV 网,边,3,0
抽象数据类型是缩容的重要属性,attr,缩容,抽象数据类型,7,0
稀疏图的特征是链式存储,b-attr,链式存储,稀疏图,7,0
复制的特征是前缀树,attr,复制,前缀树,0,6
分治是数据元素的重要属性,b-attr,分治,数据元素,0,3
在算法中，线性表和归并排序执行相反的功能,anto,线性表,归并排序,5,9
势能方法是会计方法的组成部分,b-belg,势能方法,会计方法,0,5
Floyd算法具有入队属性,b-attr,入队,Floyd算法,9,0
平均情况的特征是不相交集合,attr,平均情况,不相交集合,0,8
在旋转中包含了加权图,belg,旋转,加权图,1,7
贪心策略是平衡二叉树的组成部分,b-belg,贪心策略,平衡二叉树,0,5
折半查找与Dijkstra算法具有相反的作用,anto,折半查找,Dijkstra算法,0,5
实现图的边时需要依赖普里姆算法,b-rely,普里姆算法,图的边,10,2
引用需要使用插值查找,rely,引用,插值查找,0,6
实现多源最短路径时需要依赖递归基础,rely,多源最短路径,递归基础,2,13
递归复杂度是强连通分量的组成部分,belg,强连通分量,递归复杂度,6,0
在数据结构中，树的度和堆内存表示相同的概念,syno,树的度,堆内存,7,11
合并与位序具有相反的作用,anto,合并,位序,0,3
多源最短路径需要使用AOV 网,b-rely,AOV 网,多源最短路径,10,0
遍历和哈希表是同义概念,syno,遍历,哈希表,0,3
非比较排序由势能方法等部分构成,b-belg,势能方法,非比较排序,6,0
在关键路径中包含了移动,b-belg,移动,关键路径,9,1
小根堆是内部节点的组成部分,b-belg,小根堆,内部节点,0,4
实现图的顶点时需要依赖递归复杂度,b-rely,递归复杂度,图的顶点,11,2
销毁包含选择排序,b-belg,选择排序,销毁,4,0
桶排序具有邻接表属性,attr,桶排序,邻接表,0,5
集合的实现基于桶排序,rely,集合,桶排序,0,7
空表需要使用出栈,b-rely,出栈,空表,6,0
选择排序等同于大O记号,syno,选择排序,大O记号,0,7
稀疏图与状态转移具有相反的作用,anto,稀疏图,状态转移,0,4
递推表现出分块查找的特性,b-attr,分块查找,递推,5,0
负权回路和头节点是同义概念,syno,负权回路,头节点,0,5
强连通图和时间复杂度是同义概念,syno,强连通图,时间复杂度,0,5
分治依赖于关键路径,b-rely,关键路径,分治,5,0
后缀数组的实现基于生成森林,b-rely,生成森林,后缀数组,9,0
在算法中，数据元素和映射执行相反的功能,anto,数据元素,映射,5,10
在算法中，B+树和渐近复杂度执行相反的功能,anto,B+树,渐近复杂度,5,9
可持久化数据结构包含平衡因子,b-belg,平衡因子,可持久化数据结构,10,0
大根堆由逻辑结构等部分构成,b-belg,逻辑结构,大根堆,4,0
堆的特征是字符串,attr,堆,字符串,0,5
无序表和穷举法是对立的概念,anto,无序表,穷举法,0,4
完全二叉树等同于静态数组,syno,完全二叉树,静态数组,0,8
在遍历中包含了指数查找,b-belg,指数查找,遍历,7,1
实现栈时需要依赖树的节点,rely,栈,树的节点,2,8
桶排序的特征是连通分量,b-attr,连通分量,桶排序,7,0
插值查找具有散列表属性,b-attr,散列表,插值查找,6,0
势能方法具有顺序查找属性,b-attr,顺序查找,势能方法,6,0
有序表表现出度的特性,b-attr,度,有序表,6,0
顺序存储由局部最优等部分构成,belg,顺序存储,局部最优,0,5
移动的实现基于状态转移,b-rely,状态转移,移动,7,0
无序序列的特征是折半查找,b-attr,折半查找,无序序列,8,0
实现初始化时需要依赖树,rely,初始化,树,2,10
在算法中，字符串和布隆过滤器执行相反的功能,anto,字符串,布隆过滤器,5,9
字符串与散列存储具有相反的作用,anto,字符串,散列存储,0,4
聚合分析的实现基于空间复杂度,b-rely,空间复杂度,聚合分析,9,0
局部最优与克鲁斯卡尔算法具有相同的含义,syno,局部最优,克鲁斯卡尔算法,0,5
链表节点的特征是头节点,b-attr,头节点,链表节点,8,0
垃圾回收依赖于链地址法,rely,垃圾回收,链地址法,0,7
插值查找的特征是扩容,b-attr,扩容,插值查找,8,0
更新和满二叉树是同义概念,syno,更新,满二叉树,0,3
路径压缩需要使用数据类型,rely,路径压缩,数据类型,0,8
最长路径依赖于静态数组,b-rely,静态数组,最长路径,7,0
Ω记号是算法的确定性的组成部分,b-belg,Ω记号,算法的确定性,0,4
内存分配需要使用对象池,rely,内存分配,对象池,0,8
分治和更新是对立的概念,anto,分治,更新,0,3
贪心由二叉搜索树等部分构成,b-belg,二叉搜索树,贪心,3,0
在算法中，记忆化搜索和外部排序执行相反的功能,anto,记忆化搜索,外部排序,5,11
在算法中，引用和按秩合并执行相反的功能,anto,引用,按秩合并,5,8
小根堆的实现基于扩容,b-rely,扩容,小根堆,8,0
位序具有存储结构属性,attr,位序,存储结构,0,4
中序遍历的特征是顶点,attr,中序遍历,顶点,0,8
循环链表表现出红黑树的特性,b-attr,红黑树,循环链表,7,0
在算法中，最短路径和右子树执行相反的功能,anto,最短路径,右子树,5,10
非连通图的实现基于邻接表,b-rely,邻接表,非连通图,9,0
Prim算法表现出物理结构的特性,b-attr,物理结构,Prim算法,9,0
二叉搜索树需要使用插入,rely,二叉搜索树,插入,0,9
在多源最短路径中包含了销毁,belg,多源最短路径,销毁,1,11
选择排序需要使用分治,rely,选择排序,分治,0,8
普里姆算法包含算法步骤,b-belg,算法步骤,普里姆算法,7,0
数据项与分割具有相反的作用,anto,数据项,分割,0,4
迪杰斯特拉算法是多路归并的重要属性,attr,多路归并,迪杰斯特拉算法,8,0
AOV 网是邻接矩阵的重要属性,attr,邻接矩阵,AOV 网,6,0
直接插入排序与多源最短路径具有相同的含义,syno,直接插入排序,多源最短路径,0,7
指数查找由更新等部分构成,b-belg,更新,指数查找,5,0
前缀树与分支限界具有相同的含义,syno,前缀树,分支限界,0,4
函数式数据结构是字典树的重要属性,b-attr,函数式数据结构,字典树,0,8
在顺序存储中包含了局部最优,b-belg,局部最优,顺序存储,9,1
循环链表表现出摊还分析的特性,attr,循环链表,摊还分析,0,7
删除的特征是AC自动机,b-attr,AC自动机,删除,6,0
按秩合并需要使用分支限界,rely,按秩合并,分支限界,0,8
邻接多重表表现出层序遍历的特性,attr,邻接多重表,层序遍历,0,8
迪杰斯特拉算法具有桶排序属性,b-attr,桶排序,迪杰斯特拉算法,9,0
内存池是会计方法的重要属性,b-attr,内存池,会计方法,0,4
邻接表是树的度的重要属性,attr,树的度,邻接表,4,0
实现空间复杂度时需要依赖AC自动机,rely,空间复杂度,AC自动机,2,12
排序算法稳定性和字典树是同义概念,syno,排序算法稳定性,字典树,0,8
散列存储的特征是链表,attr,散列存储,链表,0,8
在算法中，Θ记号和无向图执行相反的功能,anto,Θ记号,无向图,5,9
计数排序表现出多源最短路径的特性,attr,计数排序,多源最短路径,0,7
动态内存具有红黑树属性,b-attr,红黑树,动态内存,6,0
非线性结构表现出队列的特性,b-attr,队列,非线性结构,8,0
在数据结构中，移动和AOE网表示相同的概念,syno,移动,AOE网,7,10
线性表的特征是算法的有穷性,b-attr,算法的有穷性,线性表,7,0
动态规划的特征是记忆化搜索,attr,动态规划,记忆化搜索,0,8
负权边需要使用排序算法稳定性,b-rely,排序算法稳定性,负权边,7,0
在算法中，分治算法和哈希函数执行相反的功能,anto,分治算法,哈希函数,5,10
拓扑排序包含AC自动机,belg,拓扑排序,AC自动机,0,6
顶点度数是头节点的重要属性,attr,头节点,顶点度数,5,0
左子树表现出重叠子问题的特性,b-attr,重叠子问题,左子树,6,0
邻接多重表需要使用最长路径,b-rely,最长路径,邻接多重表,9,0
局部最优是静态内存的重要属性,attr,静态内存,局部最优,5,0
非连通图的特征是比较排序,attr,非连通图,比较排序,0,8
多路归并和分治是相反的操作,anto,多路归并,分治,0,5
在算法中，时间复杂度和递归复杂度执行相反的功能,anto,时间复杂度,递归复杂度,5,11
父节点由算法的有穷性等部分构成,b-belg,算法的有穷性,父节点,4,0
顺序存储具有最坏情况属性,attr,顺序存储,最坏情况,0,6
后序遍历具有贪心属性,attr,后序遍历,贪心,0,6
内存分配和穷举法是相反的操作,anto,内存分配,穷举法,0,5
迭代法依赖于冒泡排序,rely,迭代法,冒泡排序,0,6
树状数组与斐波那契堆具有相反的作用,anto,树状数组,斐波那契堆,0,5
哈希表表现出双向队列的特性,attr,哈希表,双向队列,0,6
内存分配需要使用堆内存,rely,内存分配,堆内存,0,8
无序表是非比较排序的组成部分,b-belg,无序表,非比较排序,0,4
最坏情况等同于冒泡排序,syno,最坏情况,冒泡排序,0,7
记忆化搜索与二路归并具有相反的作用,anto,记忆化搜索,二路归并,0,6
在算法中，聚合分析和回溯算法执行相反的功能,anto,聚合分析,回溯算法,5,10
顺序存储需要使用原地排序,b-rely,原地排序,顺序存储,8,0
内存池需要使用散列文件,rely,内存池,散列文件,0,7
递推需要使用树,b-rely,树,递推,6,0
查找成功是多路归并的重要属性,attr,多路归并,查找成功,5,0
摊还分析和开放寻址是对立的概念,anto,摊还分析,开放寻址,0,5
树的度具有最长路径属性,attr,树的度,最长路径,0,5
跳跃表是根节点的重要属性,attr,根节点,跳跃表,4,0
加权图与垃圾回收具有相同的含义,syno,加权图,垃圾回收,0,4
Θ记号由贪心策略等部分构成,belg,Θ记号,贪心策略,0,4
对象池需要使用层序遍历,rely,对象池,层序遍历,0,7
抽象数据类型需要使用哈希表,b-rely,哈希表,抽象数据类型,10,0
关键路径的实现基于单链表,b-rely,单链表,关键路径,9,0
栈内存依赖于平衡,b-rely,平衡,栈内存,6,0
在数据结构中，静态内存和满二叉树表示相同的概念,syno,静态内存,满二叉树,7,12
实现顶点时需要依赖非比较排序,b-rely,非比较排序,顶点,9,2
哈希表的实现基于简单排序,b-rely,简单排序,哈希表,8,0
实现多源最短路径时需要依赖动态内存,b-rely,动态内存,多源最短路径,13,2
数据类型的特征是最长路径,attr,数据类型,最长路径,0,8
图需要使用后序遍历,rely,图,后序遍历,0,5
动态查找的实现基于迪杰斯特拉算法,b-rely,迪杰斯特拉算法,动态查找,9,0
散列表的特征是更新,attr,散列表,更新,0,7
全局最优具有边表属性,b-attr,边表,全局最优,6,0
删除由加权图等部分构成,b-belg,加权图,删除,3,0
父节点表现出普里姆算法的特性,b-attr,普里姆算法,父节点,6,0
顺序访问和线段树是同义概念,syno,顺序访问,线段树,0,5
KMP算法包含摊还分析,belg,KMP算法,摊还分析,0,7
负权边是稳定性的组成部分,b-belg,负权边,稳定性,0,4
空间复杂度是出栈的组成部分,belg,出栈,空间复杂度,6,0
冲突解决依赖于存储结构,rely,冲突解决,存储结构,0,7
平衡因子具有Θ记号属性,b-attr,Θ记号,平衡因子,6,0
非比较排序是动态规划的组成部分,belg,动态规划,非比较排序,6,0
在算法中，拓扑排序和双端队列执行相反的功能,anto,拓扑排序,双端队列,5,10
迭代是子树的组成部分,b-belg,迭代,子树,0,3
最好情况是环的组成部分,b-belg,最好情况,环,0,5
强连通图包含贪心算法,b-belg,贪心算法,强连通图,6,0
更新依赖于完全二叉树,rely,更新,完全二叉树,0,5
在弱连通图中包含了Ω记号,belg,弱连通图,Ω记号,1,9
实现原地排序时需要依赖摊还分析,b-rely,摊还分析,原地排序,11,2
非连通图表现出稀疏图的特性,b-attr,稀疏图,非连通图,7,0
在内部排序中包含了红黑树,belg,内部排序,红黑树,1,9
AVL树具有边属性,attr,AVL树,边,0,6
在算法中，动态内存和负权边执行相反的功能,anto,动态内存,负权边,5,10
在二叉搜索树中包含了深度优先搜索,belg,二叉搜索树,深度优先搜索,1,10
实现静态内存时需要依赖尾节点,rely,静态内存,尾节点,2,11
迭代法和插入是相反的操作,anto,迭代法,插入,0,4
按秩合并等同于路径压缩,syno,按秩合并,路径压缩,0,7
贪心是LRU缓存的组成部分,belg,LRU缓存,贪心,3,0
后缀树的实现基于头节点,rely,后缀树,头节点,0,8
链式存储需要使用最长路径,b-rely,最长路径,链式存储,8,0
时间复杂度需要使用计数排序,b-rely,计数排序,时间复杂度,9,0
字典树的特征是选择排序,attr,字典树,选择排序,0,7
哈希查找需要使用数据项,b-rely,数据项,哈希查找,8,0
在数据结构中，哈希查找和头节点表示相同的概念,syno,哈希查找,头节点,7,12
在十字链表中包含了树状数组,b-belg,树状数组,十字链表,9,1
递推表现出边的权重的特性,attr,递推,边的权重,0,5
稀疏图和散列文件是相反的操作,anto,稀疏图,散列文件,0,4
开放寻址的实现基于队列,b-rely,队列,开放寻址,9,0
表头和AOV 网是对立的概念,anto,表头,AOV 网,0,3
尾节点和散列存储是对立的概念,anto,尾节点,散列存储,0,4
记忆化搜索与空表具有相同的含义,syno,记忆化搜索,空表,0,6
循环队列依赖于递归,rely,循环队列,递归,0,7
图是边的权重的组成部分,belg,边的权重,图,2,0
AVL树与全局最优具有相反的作用,anto,AVL树,全局最优,0,5
出度的实现基于静态查找,b-rely,静态查找,出度,7,0
实现顺序查找时需要依赖平衡因子,b-rely,平衡因子,顺序查找,11,2
位序的实现基于分支限界,rely,位序,分支限界,0,7
哈希函数与环具有相同的含义,syno,哈希函数,环,0,5
边的方向由关键路径等部分构成,belg,边的方向,关键路径,0,5
实现多路归并时需要依赖入栈,b-rely,入栈,多路归并,11,2
稳定性依赖于顺序查找,b-rely,顺序查找,稳定性,6,0
实现哈希查找时需要依赖聚合分析,rely,哈希查找,聚合分析,2,11
顶点是最优子结构的组成部分,belg,最优子结构,顶点,3,0
前驱节点具有邻接表属性,attr,前驱节点,邻接表,0,6
缩容是遍历的重要属性,b-attr,缩容,遍历,0,3
子树依赖于比较排序,b-rely,比较排序,子树,5,0
AVL树表现出顺序查找的特性,b-attr,顺序查找,AVL树,7,0
堆内存包含递归基础,b-belg,递归基础,堆内存,5,0
线性查找是简单排序的重要属性,b-attr,线性查找,简单排序,0,5
动态数组由排序等部分构成,b-belg,排序,动态数组,5,0
归并排序是链式存储的重要属性,b-attr,归并排序,链式存储,0,5
克鲁斯卡尔算法需要使用查找成功,rely,克鲁斯卡尔算法,查找成功,0,11
布隆过滤器具有索引存储属性,attr,布隆过滤器,索引存储,0,7
垃圾回收和图的顶点是同义概念,syno,垃圾回收,图的顶点,0,5
AOV 网需要使用静态数组,rely,AOV 网,静态数组,0,9
状态转移是物理结构的组成部分,belg,物理结构,状态转移,5,0
指针表现出广度优先搜索的特性,attr,指针,广度优先搜索,0,5
哈希函数和树的深度是同义概念,syno,哈希函数,树的深度,0,5
线性表和索引存储是对立的概念,anto,线性表,索引存储,0,4
在邻接矩阵中包含了删除,belg,邻接矩阵,删除,1,9
后缀数组需要使用深度优先搜索,rely,后缀数组,深度优先搜索,0,8
随机访问表现出物理结构的特性,attr,随机访问,物理结构,0,7
LRU缓存具有堆属性,b-attr,堆,LRU缓存,7,0
在数据结构中，不稳定排序和树的深度表示相同的概念,syno,不稳定排序,树的深度,7,13
实现分割时需要依赖父节点,rely,分割,父节点,2,9
入度由布隆过滤器等部分构成,belg,入度,布隆过滤器,0,3
多源最短路径等同于顺序存储,syno,多源最短路径,顺序存储,0,9
二分查找与尾节点具有相同的含义,syno,二分查找,尾节点,0,5
关键路径依赖于入栈,rely,关键路径,入栈,0,7
动态内存和记忆化搜索是同义概念,syno,动态内存,记忆化搜索,0,5
访问是父节点的组成部分,b-belg,访问,父节点,0,3
回溯算法的实现基于操作效率,rely,回溯算法,操作效率,0,9
迭代法表现出不稳定排序的特性,attr,迭代法,不稳定排序,0,6
左子树和渐近复杂度是同义概念,syno,左子树,渐近复杂度,0,4
移动的实现基于全局最优,rely,移动,全局最优,0,7
实现顺序查找时需要依赖递归,b-rely,递归,顺序查找,11,2
散列存储依赖于比较排序,rely,散列存储,比较排序,0,7
数组需要使用全局最优,b-rely,全局最优,数组,6,0
最小生成树依赖于散列存储,b-rely,散列存储,最小生成树,8,0
边需要使用连通图,b-rely,连通图,边,5,0
线性表包含KMP算法,belg,线性表,KMP算法,0,5
邻接矩阵与表头具有相同的含义,syno,邻接矩阵,表头,0,5
散列文件和算法的有穷性是同义概念,syno,散列文件,算法的有穷性,0,5
负权回路是单源最短路径的组成部分,belg,单源最短路径,负权回路,5,0
顺序查找由存储结构等部分构成,belg,顺序查找,存储结构,0,5
拓扑排序表现出树的特性,attr,拓扑排序,树,0,7
哈希查找具有无向图属性,b-attr,无向图,哈希查找,6,0
在算法中，动态内存和平均查找长度执行相反的功能,anto,动态内存,平均查找长度,5,10
父节点由状态转移等部分构成,belg,父节点,状态转移,0,4
图的特征是最坏情况,b-attr,最坏情况,图,5,0
红黑树依赖于关键路径,b-rely,关键路径,红黑树,6,0
更新是二项堆的重要属性,b-attr,更新,二项堆,0,3
Bellman-Ford算法和树是相反的操作,anto,Bellman-Ford算法,树,0,15
链表节点是贪心算法的组成部分,b-belg,链表节点,贪心算法,0,5
图的顶点具有平均情况属性,attr,图的顶点,平均情况,0,6
贪心选择性质表现出广度优先搜索的特性,b-attr,广度优先搜索,贪心选择性质,9,0
最坏情况是Dijkstra算法的重要属性,b-attr,最坏情况,Dijkstra算法,0,5
记忆化搜索具有哈希函数属性,b-attr,哈希函数,记忆化搜索,7,0
后缀树的实现基于线性表,b-rely,线性表,后缀树,8,0
实现尾节点时需要依赖时间复杂度,rely,尾节点,时间复杂度,2,10
链表节点是单源最短路径的组成部分,belg,单源最短路径,链表节点,5,0
实现十字链表时需要依赖加权图,b-rely,加权图,十字链表,11,2
简单排序包含插入,b-belg,插入,简单排序,6,0
索引存储与归并排序具有相同的含义,syno,索引存储,归并排序,0,5
更新由邻接矩阵等部分构成,b-belg,邻接矩阵,更新,3,0
表尾包含负权回路,belg,表尾,负权回路,0,4
在哈希表中包含了AOE 网,b-belg,AOE 网,哈希表,8,1
实现算法的确定性时需要依赖最长路径,b-rely,最长路径,算法的确定性,13,2
算法的可行性是顺序存储的组成部分,belg,顺序存储,算法的可行性,7,0
散列存储由LRU缓存等部分构成,b-belg,LRU缓存,散列存储,5,0
顶点度数具有指数查找属性,attr,顶点度数,指数查找,0,6
入队和双端队列是相反的操作,anto,入队,双端队列,0,3
选择排序包含连通图,belg,选择排序,连通图,0,6
扩容依赖于Θ记号,rely,扩容,Θ记号,0,5
Dijkstra算法的特征是随机访问,b-attr,随机访问,Dijkstra算法,14,0
会计方法包含边表,belg,会计方法,边表,0,6
可持久化数据结构具有出队属性,b-attr,出队,可持久化数据结构,10,0
算法的确定性和映射是同义概念,syno,算法的确定性,映射,0,7
