sentence,relation,head,tail,head_offset,tail_offset
Θ记号是双向队列的组成部分,belg,双向队列,Θ记号,4,0
动态规划入门具有栈内存属性,attr,动态规划入门,栈内存,0,8
回溯法的特征是无序序列,attr,回溯法,无序序列,0,7
物理结构是无序序列的组成部分,b-belg,物理结构,无序序列,0,5
折半查找是查找的组成部分,belg,查找,折半查找,2,0
平衡因子由二路归并等部分构成,b-belg,二路归并,平衡因子,5,0
快速排序是边的权重的重要属性,b-attr,快速排序,边的权重,0,5
有序序列与无向图具有相反的作用,anto,有序序列,无向图,0,5
动态规划入门的特征是存储结构,attr,动态规划入门,存储结构,0,10
线段树依赖于二叉搜索树,b-rely,二叉搜索树,线段树,6,0
聚合分析与垃圾回收具有相反的作用,anto,聚合分析,垃圾回收,0,5
空间复杂度和引用计数是相反的操作,anto,空间复杂度,引用计数,0,6
随机访问的特征是AOE 网,attr,随机访问,AOE 网,0,8
空间复杂度需要使用十字链表,rely,空间复杂度,十字链表,0,9
空间复杂度表现出Θ记号的特性,attr,空间复杂度,Θ记号,0,8
在栈内存中包含了指数查找,b-belg,指数查找,栈内存,8,1
哈希查找和顺序访问是同义概念,syno,哈希查找,顺序访问,0,5
算法步骤具有负权回路属性,b-attr,负权回路,算法步骤,6,0
链式存储是前驱节点的组成部分,belg,前驱节点,链式存储,5,0
时间复杂度具有非比较排序属性,b-attr,非比较排序,时间复杂度,7,0
非连通图具有多源最短路径属性,b-attr,多源最短路径,非连通图,6,0
存储结构等同于散列表,syno,存储结构,散列表,0,7
弱连通图是广度优先搜索的重要属性,b-attr,弱连通图,广度优先搜索,0,5
内部节点是访问的组成部分,b-belg,内部节点,访问,0,5
内存池表现出引用计数的特性,b-attr,引用计数,内存池,6,0
在数据结构中，弗洛伊德算法和排序算法稳定性表示相同的概念,syno,弗洛伊德算法,排序算法稳定性,7,14
邻接表等同于右子树,syno,邻接表,右子树,0,6
有序序列与引用具有相反的作用,anto,有序序列,引用,0,5
字符串和图的顶点是同义概念,syno,字符串,图的顶点,0,4
查找成功的特征是垃圾回收,attr,查找成功,垃圾回收,0,8
强连通分量和树是对立的概念,anto,强连通分量,树,0,6
最长路径等同于合并,syno,最长路径,合并,0,7
平衡二叉树和最优子结构是对立的概念,anto,平衡二叉树,最优子结构,0,6
实现垃圾回收时需要依赖图,rely,垃圾回收,图,2,11
桶排序的实现基于AOE 网,b-rely,AOE 网,桶排序,8,0
状态转移需要使用表尾,rely,状态转移,表尾,0,8
在算法中，前序遍历和引用执行相反的功能,anto,前序遍历,引用,5,10
有序表需要使用边的方向,b-rely,边的方向,有序表,7,0
有序序列是双向队列的组成部分,belg,双向队列,有序序列,5,0
分割由树的高度等部分构成,belg,分割,树的高度,0,3
指数查找表现出合并的特性,attr,指数查找,合并,0,7
指针是出队的重要属性,attr,出队,指针,3,0
在数据结构中，访问和负权边表示相同的概念,syno,访问,负权边,7,10
实现存储结构时需要依赖内部节点,b-rely,内部节点,存储结构,11,2
AC自动机是动态规划入门的组成部分,b-belg,AC自动机,动态规划入门,0,6
跳跃表具有循环队列属性,b-attr,循环队列,跳跃表,5,0
指数查找具有KMP算法属性,attr,指数查找,KMP算法,0,6
稳定排序是非连通图的重要属性,b-attr,稳定排序,非连通图,0,5
尾节点的特征是AVL树,attr,尾节点,AVL树,0,7
后缀树是内存回收的组成部分,belg,内存回收,后缀树,4,0
对象池由穷举法等部分构成,b-belg,穷举法,对象池,4,0
后缀树和动态内存是对立的概念,anto,后缀树,动态内存,0,4
堆排序需要使用Prim算法,b-rely,Prim算法,堆排序,7,0
更新和多路归并是对立的概念,anto,更新,多路归并,0,3
在数据结构中，空间复杂度和顺序存储表示相同的概念,syno,空间复杂度,顺序存储,7,13
函数式数据结构具有度属性,b-attr,度,函数式数据结构,9,0
双向队列与索引存储具有相同的含义,syno,双向队列,索引存储,0,5
后缀树需要使用数据类型,rely,后缀树,数据类型,0,7
图的边的实现基于最好情况,rely,图的边,最好情况,0,8
抽象数据类型需要使用KMP算法,rely,抽象数据类型,KMP算法,0,10
负权边具有强连通分量属性,b-attr,强连通分量,负权边,5,0
克鲁斯卡尔算法等同于二叉树,syno,克鲁斯卡尔算法,二叉树,0,10
在平均情况中包含了交换排序,belg,平均情况,交换排序,1,9
单链表的实现基于非比较排序,rely,单链表,非比较排序,0,8
实现强连通图时需要依赖分支限界,rely,强连通图,分支限界,2,11
大O记号等同于回路,syno,大O记号,回路,0,7
实现有序表时需要依赖LRU缓存,rely,有序表,LRU缓存,2,10
贪心表现出穷举法的特性,attr,贪心,穷举法,0,5
无向图和全局最优是同义概念,syno,无向图,全局最优,0,4
移动包含双端队列,belg,移动,双端队列,0,4
在双向队列中包含了边的权重,b-belg,边的权重,双向队列,9,1
随机访问包含后序遍历,belg,随机访问,后序遍历,0,6
满二叉树由逻辑结构等部分构成,b-belg,逻辑结构,满二叉树,5,0
表长表现出环的特性,b-attr,环,表长,5,0
平衡是贪心策略的重要属性,b-attr,平衡,贪心策略,0,3
选择排序是存储结构的组成部分,belg,存储结构,选择排序,5,0
左子树需要使用双向链表,rely,左子树,双向链表,0,7
实现树状数组时需要依赖局部最优,rely,树状数组,局部最优,2,11
贪心选择性质的实现基于布隆过滤器,rely,贪心选择性质,布隆过滤器,0,11
排序由后序遍历等部分构成,belg,排序,后序遍历,0,3
深度优先搜索由强连通分量等部分构成,b-belg,强连通分量,深度优先搜索,7,0
在算法中，循环队列和图的边执行相反的功能,anto,循环队列,图的边,5,10
算法的有穷性依赖于尾节点,rely,算法的有穷性,尾节点,0,9
顺序存储具有排序属性,b-attr,排序,顺序存储,6,0
KMP算法和势能方法是对立的概念,anto,KMP算法,势能方法,0,6
时间复杂度和插值查找是同义概念,syno,时间复杂度,插值查找,0,6
布隆过滤器依赖于冲突解决,b-rely,冲突解决,布隆过滤器,8,0
在动态数组中包含了AOE 网,belg,动态数组,AOE 网,1,9
红黑树和AOV 网是对立的概念,anto,红黑树,AOV 网,0,4
引用计数与克鲁斯卡尔算法具有相同的含义,syno,引用计数,克鲁斯卡尔算法,0,5
穷举法是平均查找长度的重要属性,attr,平均查找长度,穷举法,4,0
字典树包含递推,belg,字典树,递推,0,5
动态内存包含希尔排序,b-belg,希尔排序,动态内存,6,0
抽象数据类型和堆内存是相反的操作,anto,抽象数据类型,堆内存,0,7
无向图需要使用复制,b-rely,复制,无向图,7,0
查找包含递归,belg,查找,递归,0,4
交换排序是树状数组的重要属性,b-attr,交换排序,树状数组,0,5
布隆过滤器具有计数排序属性,b-attr,计数排序,布隆过滤器,7,0
数组与平衡二叉树具有相同的含义,syno,数组,平衡二叉树,0,3
数组由树等部分构成,belg,数组,树,0,3
在算法中，树的节点和散列表执行相反的功能,anto,树的节点,散列表,5,10
桶排序表现出前序遍历的特性,attr,桶排序,前序遍历,0,6
循环队列和逻辑结构是同义概念,syno,循环队列,逻辑结构,0,5
表尾是回溯算法的组成部分,b-belg,表尾,回溯算法,0,3
在平衡中包含了全局最优,b-belg,全局最优,平衡,7,1
负权边和左子树是相反的操作,anto,负权边,左子树,0,4
单链表是重叠子问题的组成部分,belg,重叠子问题,单链表,4,0
KMP算法和引用计数是相反的操作,anto,KMP算法,引用计数,0,6
在AC自动机中包含了数据元素,b-belg,数据元素,AC自动机,10,1
并查集依赖于哈希函数,rely,并查集,哈希函数,0,6
Kruskal算法具有数据类型属性,b-attr,数据类型,Kruskal算法,11,0
图依赖于中序遍历,rely,图,中序遍历,0,4
回路包含分割,belg,回路,分割,0,4
可持久化数据结构的特征是出栈,attr,可持久化数据结构,出栈,0,12
合并由单链表等部分构成,b-belg,单链表,合并,3,0
栈依赖于叶子节点,rely,栈,叶子节点,0,4
初始化和存储结构是对立的概念,anto,初始化,存储结构,0,4
在数据结构中，前缀树和字典树表示相同的概念,syno,前缀树,字典树,7,11
算法的确定性具有静态数组属性,attr,算法的确定性,静态数组,0,8
边的权重的实现基于数据元素,b-rely,数据元素,边的权重,9,0
旋转的特征是递归基础,b-attr,递归基础,旋转,6,0
空间复杂度的实现基于最优子结构,b-rely,最优子结构,空间复杂度,10,0
树和父节点是相反的操作,anto,树,父节点,0,2
在数据结构中，分块查找和字符串表示相同的概念,syno,分块查找,字符串,7,12
在AVL树中包含了入度,b-belg,入度,AVL树,9,1
实现树的深度时需要依赖尾节点,b-rely,尾节点,树的深度,11,2
后继节点包含字符串,b-belg,字符串,后继节点,6,0
冲突解决需要使用并查集,b-rely,并查集,冲突解决,8,0
逻辑结构表现出希尔排序的特性,attr,逻辑结构,希尔排序,0,7
递归复杂度包含大根堆,b-belg,大根堆,递归复杂度,7,0
合并由B+树等部分构成,belg,合并,B+树,0,3
在重叠子问题中包含了稳定性,b-belg,稳定性,重叠子问题,10,1
AC自动机包含最坏情况,b-belg,最坏情况,AC自动机,7,0
按秩合并等同于不相交集合,syno,按秩合并,不相交集合,0,7
递归基础依赖于动态内存,b-rely,动态内存,递归基础,7,0
KMP算法的特征是非线性结构,attr,KMP算法,非线性结构,0,9
实现扩容时需要依赖引用,b-rely,引用,扩容,9,2
在算法中，内存回收和优先队列执行相反的功能,anto,内存回收,优先队列,5,10
快速排序的实现基于层序遍历,b-rely,层序遍历,快速排序,9,0
树的节点与访问具有相同的含义,syno,树的节点,访问,0,5
树的节点包含Ω记号,b-belg,Ω记号,树的节点,6,0
状态转移是AVL树的组成部分,belg,AVL树,状态转移,5,0
跳跃表需要使用记忆化搜索,rely,跳跃表,记忆化搜索,0,7
归并排序表现出最优子结构的特性,attr,归并排序,最优子结构,0,7
在算法中，桶排序和贪心选择性质执行相反的功能,anto,桶排序,贪心选择性质,5,9
根节点由二叉搜索树等部分构成,belg,根节点,二叉搜索树,0,4
链式存储是二分查找的重要属性,attr,二分查找,链式存储,5,0
中序遍历具有线性结构属性,attr,中序遍历,线性结构,0,6
单源最短路径表现出环的特性,b-attr,环,单源最短路径,9,0
递归基础的实现基于邻接多重表,b-rely,邻接多重表,递归基础,9,0
前驱节点的实现基于旋转,b-rely,旋转,前驱节点,9,0
稀疏图包含顶点,belg,稀疏图,顶点,0,5
左子树和指针是同义概念,syno,左子树,指针,0,4
原地排序等同于简单排序,syno,原地排序,简单排序,0,7
指针表现出按秩合并的特性,b-attr,按秩合并,指针,5,0
实现中序遍历时需要依赖加权图,rely,中序遍历,加权图,2,11
哈希查找具有平衡因子属性,b-attr,平衡因子,哈希查找,6,0
斐波那契堆需要使用分治算法,rely,斐波那契堆,分治算法,0,9
边的权重依赖于树的度,rely,边的权重,树的度,0,7
入队具有AVL树属性,b-attr,AVL树,入队,4,0
邻接矩阵和子树是相反的操作,anto,邻接矩阵,子树,0,5
实现冒泡排序时需要依赖空间复杂度,b-rely,空间复杂度,冒泡排序,11,2
数组是删除的重要属性,b-attr,数组,删除,0,3
在算法中，克鲁斯卡尔算法和邻接矩阵执行相反的功能,anto,克鲁斯卡尔算法,邻接矩阵,5,13
在数据结构中，贪心和尾节点表示相同的概念,syno,贪心,尾节点,7,10
函数式数据结构表现出广度优先搜索的特性,b-attr,广度优先搜索,函数式数据结构,10,0
强连通图包含动态内存,b-belg,动态内存,强连通图,6,0
在迭代中包含了Θ记号,b-belg,Θ记号,迭代,7,1
单链表具有平衡二叉树属性,attr,单链表,平衡二叉树,0,5
在数据结构中，二叉树和哈希函数表示相同的概念,syno,二叉树,哈希函数,7,11
并查集和访问是对立的概念,anto,并查集,访问,0,4
递归是稳定排序的组成部分,belg,稳定排序,递归,3,0
分治的特征是多路归并,attr,分治,多路归并,0,6
度由顺序查找等部分构成,b-belg,顺序查找,度,2,0
指数查找需要使用B树,b-rely,B树,指数查找,8,0
最小生成树包含初始化,belg,最小生成树,初始化,0,7
指针与递归具有相反的作用,anto,指针,递归,0,3
栈与交换排序具有相同的含义,syno,栈,交换排序,0,2
回溯算法与更新具有相同的含义,syno,回溯算法,更新,0,5
算法的有穷性和插入排序是相反的操作,anto,算法的有穷性,插入排序,0,7
最优子结构由平衡二叉树等部分构成,belg,最优子结构,平衡二叉树,0,6
边表是原地排序的组成部分,b-belg,边表,原地排序,0,3
有向图表现出旋转的特性,attr,有向图,旋转,0,6
遍历包含多源最短路径,belg,遍历,多源最短路径,0,4
邻接表需要使用交换排序,rely,邻接表,交换排序,0,7
数据项表现出队列的特性,attr,数据项,队列,0,6
销毁包含随机访问,belg,销毁,随机访问,0,4
出度与非比较排序具有相反的作用,anto,出度,非比较排序,0,3
连通分量与渐近复杂度具有相同的含义,syno,连通分量,渐近复杂度,0,5
记忆化搜索由状态转移等部分构成,b-belg,状态转移,记忆化搜索,6,0
最优子结构依赖于内部排序,rely,最优子结构,内部排序,0,8
重叠子问题是折半查找的组成部分,belg,折半查找,重叠子问题,6,0
不相交集合和中序遍历是相反的操作,anto,不相交集合,中序遍历,0,6
队列需要使用局部最优,rely,队列,局部最优,0,6
局部最优和稳定排序是同义概念,syno,局部最优,稳定排序,0,5
弗洛伊德算法和图的顶点是对立的概念,anto,弗洛伊德算法,图的顶点,0,7
广度优先搜索的实现基于初始化,rely,广度优先搜索,初始化,0,11
路径和表头是对立的概念,anto,路径,表头,0,3
算法的可行性包含最坏情况,b-belg,最坏情况,算法的可行性,8,0
在负权回路中包含了B树,b-belg,B树,负权回路,9,1
查找失败是线性查找的重要属性,b-attr,查找失败,线性查找,0,5
冲突解决需要使用Θ记号,b-rely,Θ记号,冲突解决,8,0
位序的特征是无向图,b-attr,无向图,位序,6,0
表尾和Floyd算法是对立的概念,anto,表尾,Floyd算法,0,3
平衡因子具有入队属性,attr,平衡因子,入队,0,6
原地排序由简单排序等部分构成,belg,原地排序,简单排序,0,5
回路与时间复杂度具有相反的作用,anto,回路,时间复杂度,0,3
基数排序是树的深度的重要属性,attr,树的深度,基数排序,5,0
函数式数据结构的实现基于移动,b-rely,移动,函数式数据结构,12,0
满二叉树包含图的边,belg,满二叉树,图的边,0,6
出队和哈希表是相反的操作,anto,出队,哈希表,0,3
最长路径由逻辑结构等部分构成,b-belg,逻辑结构,最长路径,5,0
稳定排序是队列的组成部分,belg,队列,稳定排序,5,0
分支限界包含回溯法,belg,分支限界,回溯法,0,6
AOV网的特征是前序遍历,attr,AOV网,前序遍历,0,8
实现数据项时需要依赖分块查找,b-rely,分块查找,数据项,10,2
集合的特征是并查集,b-attr,并查集,集合,6,0
在算法的可行性中包含了更新,b-belg,更新,算法的可行性,11,1
原地排序是跳跃表的组成部分,b-belg,原地排序,跳跃表,0,5
内存回收是位序的组成部分,belg,位序,内存回收,5,0
邻接表需要使用队列,b-rely,队列,邻接表,7,0
邻接矩阵和函数式数据结构是对立的概念,anto,邻接矩阵,函数式数据结构,0,5
负权回路具有动态数组属性,attr,负权回路,动态数组,0,6
平均情况需要使用交换排序,b-rely,交换排序,平均情况,8,0
选择排序依赖于二路归并,b-rely,二路归并,选择排序,7,0
多路归并是弗洛伊德算法的组成部分,belg,弗洛伊德算法,多路归并,5,0
在生成森林中包含了最长路径,belg,生成森林,最长路径,1,9
在数据结构中，内部节点和并查集表示相同的概念,syno,内部节点,并查集,7,12
循环队列由算法步骤等部分构成,b-belg,算法步骤,循环队列,5,0
布隆过滤器是链表节点的组成部分,b-belg,布隆过滤器,链表节点,0,6
AOE 网等同于最好情况,syno,AOE 网,最好情况,0,8
在算法中，双端队列和关键路径执行相反的功能,anto,双端队列,关键路径,5,10
栈和AOE 网是对立的概念,anto,栈,AOE 网,0,2
实现红黑树时需要依赖图的顶点,rely,红黑树,图的顶点,2,10
实现完全二叉树时需要依赖入度,rely,完全二叉树,入度,2,12
平均情况的实现基于根节点,rely,平均情况,根节点,0,9
根节点由空表等部分构成,belg,根节点,空表,0,4
栈内存由摊还分析等部分构成,belg,栈内存,摊还分析,0,4
删除依赖于散列文件,b-rely,散列文件,删除,5,0
垃圾回收是边的权重的组成部分,b-belg,垃圾回收,边的权重,0,5
静态查找由入度等部分构成,b-belg,入度,静态查找,5,0
数据元素等同于回溯算法,syno,数据元素,回溯算法,0,7
右子树具有递归复杂度属性,attr,右子树,递归复杂度,0,5
弗洛伊德算法依赖于连通图,b-rely,连通图,弗洛伊德算法,9,0
邻接多重表需要使用AVL树,b-rely,AVL树,邻接多重表,9,0
函数式数据结构包含数据元素,belg,函数式数据结构,数据元素,0,9
后缀数组由空间复杂度等部分构成,belg,后缀数组,空间复杂度,0,5
数据项需要使用AOV 网,b-rely,AOV 网,数据项,7,0
不相交集合和扩容是对立的概念,anto,不相交集合,扩容,0,6
映射是Bellman-Ford算法的组成部分,b-belg,映射,Bellman-Ford算法,0,3
稠密图表现出遍历的特性,b-attr,遍历,稠密图,6,0
分治算法是图的边的组成部分,belg,图的边,分治算法,5,0
在数据结构中，树的深度和并查集表示相同的概念,syno,树的深度,并查集,7,12
堆排序与树表查找具有相反的作用,anto,堆排序,树表查找,0,4
根节点依赖于生成森林,rely,根节点,生成森林,0,6
堆排序由按秩合并等部分构成,b-belg,按秩合并,堆排序,4,0
二项堆是AOV网的组成部分,belg,AOV网,二项堆,4,0
实现哈希函数时需要依赖聚合分析,rely,哈希函数,聚合分析,2,11
数据项是优先队列的组成部分,belg,优先队列,数据项,4,0
缩容是无序表的重要属性,b-attr,缩容,无序表,0,3
聚合分析依赖于最好情况,rely,聚合分析,最好情况,0,7
实现数据项时需要依赖贪心,rely,数据项,贪心,2,10
查找失败与字符串具有相反的作用,anto,查找失败,字符串,0,5
合并等同于平衡因子,syno,合并,平衡因子,0,5
AVL树等同于状态转移,syno,AVL树,状态转移,0,7
在二分查找中包含了可持久化数据结构,belg,二分查找,可持久化数据结构,1,9
访问表现出可持久化数据结构的特性,b-attr,可持久化数据结构,访问,5,0
稳定性由双端队列等部分构成,belg,稳定性,双端队列,0,4
快速排序是平均情况的重要属性,b-attr,快速排序,平均情况,0,5
负权回路具有计数排序属性,b-attr,计数排序,负权回路,6,0
空间复杂度是广度优先搜索的重要属性,attr,广度优先搜索,空间复杂度,6,0
循环链表是KMP算法的重要属性,attr,KMP算法,循环链表,5,0
前序遍历是树的高度的重要属性,b-attr,前序遍历,树的高度,0,5
原地排序需要使用顶点度数,b-rely,顶点度数,原地排序,8,0
表尾包含字典树,b-belg,字典树,表尾,4,0
出度需要使用无序序列,b-rely,无序序列,出度,6,0
销毁依赖于完全二叉树,b-rely,完全二叉树,销毁,5,0
表尾的特征是逻辑结构,attr,表尾,逻辑结构,0,6
在贪心选择性质中包含了分割,b-belg,分割,贪心选择性质,11,1
负权回路由右子树等部分构成,belg,负权回路,右子树,0,5
可持久化数据结构与递归复杂度具有相同的含义,syno,可持久化数据结构,递归复杂度,0,9
Kruskal算法包含最好情况,b-belg,最好情况,Kruskal算法,11,0
不相交集合依赖于表头,rely,不相交集合,表头,0,8
子节点具有Dijkstra算法属性,b-attr,Dijkstra算法,子节点,5,0
实现树的节点时需要依赖快速排序,b-rely,快速排序,树的节点,11,2
强连通图与聚合分析具有相反的作用,anto,强连通图,聚合分析,0,5
算法的可行性的实现基于环,rely,算法的可行性,环,0,11
实现冲突解决时需要依赖快速排序,rely,冲突解决,快速排序,2,11
负权边和集合是同义概念,syno,负权边,集合,0,4
实现内存回收时需要依赖二叉树,b-rely,二叉树,内存回收,11,2
访问是引用计数的重要属性,b-attr,访问,引用计数,0,3
稠密图与初始化具有相同的含义,syno,稠密图,初始化,0,4
表头表现出快速排序的特性,b-attr,快速排序,表头,5,0
回溯算法的特征是查找失败,attr,回溯算法,查找失败,0,8
动态数组由迭代等部分构成,belg,动态数组,迭代,0,5
头节点是比较排序的重要属性,attr,比较排序,头节点,4,0
数组和表长是相反的操作,anto,数组,表长,0,3
查找失败与平均查找长度具有相同的含义,syno,查找失败,平均查找长度,0,5
稳定性和聚合分析是对立的概念,anto,稳定性,聚合分析,0,4
链地址法的特征是顶点度数,attr,链地址法,顶点度数,0,8
斐波那契堆的实现基于二路归并,b-rely,二路归并,斐波那契堆,10,0
实现表长时需要依赖数据项,rely,表长,数据项,2,9
抽象数据类型需要使用查找失败,rely,抽象数据类型,查找失败,0,10
分支限界具有并查集属性,b-attr,并查集,分支限界,6,0
生成森林依赖于动态数组,b-rely,动态数组,生成森林,7,0
在数据结构中，平均情况和拓扑排序表示相同的概念,syno,平均情况,拓扑排序,7,12
实现前驱节点时需要依赖双向队列,rely,前驱节点,双向队列,2,11
静态查找具有AC自动机属性,b-attr,AC自动机,静态查找,6,0
引用计数是优先队列的组成部分,belg,优先队列,引用计数,5,0
算法的可行性是AOV网的组成部分,b-belg,算法的可行性,AOV网,0,7
前驱节点与排序具有相反的作用,anto,前驱节点,排序,0,5
实现递归复杂度时需要依赖AOE网,rely,递归复杂度,AOE网,2,12
数据元素的实现基于合并,b-rely,合并,数据元素,9,0
算法的确定性的实现基于更新,rely,算法的确定性,更新,0,11
后继节点和栈内存是同义概念,syno,后继节点,栈内存,0,5
树表查找需要使用中序遍历,rely,树表查找,中序遍历,0,8
算法的有穷性包含希尔排序,b-belg,希尔排序,算法的有穷性,8,0
稳定排序包含邻接矩阵,belg,稳定排序,邻接矩阵,0,6
边的权重具有稳定性属性,b-attr,稳定性,边的权重,6,0
AOV 网依赖于归并排序,b-rely,归并排序,AOV 网,8,0
实现静态查找时需要依赖销毁,b-rely,销毁,静态查找,11,2
实现边的方向时需要依赖出栈,rely,边的方向,出栈,2,11
迪杰斯特拉算法需要使用分治,rely,迪杰斯特拉算法,分治,0,11
AOV 网由可持久化数据结构等部分构成,b-belg,可持久化数据结构,AOV 网,6,0
生成森林和栈内存是对立的概念,anto,生成森林,栈内存,0,5
子节点的实现基于初始化,b-rely,初始化,子节点,8,0
在数据结构中，查找失败和贪心选择性质表示相同的概念,syno,查找失败,贪心选择性质,7,12
并查集是非连通图的组成部分,belg,非连通图,并查集,4,0
平衡二叉树依赖于哈希查找,rely,平衡二叉树,哈希查找,0,8
表尾是图的边的重要属性,attr,图的边,表尾,3,0
二路归并依赖于树状数组,b-rely,树状数组,二路归并,7,0
在希尔排序中包含了状态转移,b-belg,状态转移,希尔排序,9,1
贪心选择性质的特征是子树,b-attr,子树,贪心选择性质,10,0
访问和动态查找是对立的概念,anto,访问,动态查找,0,3
希尔排序的特征是出栈,attr,希尔排序,出栈,0,8
后缀树是强连通分量的组成部分,belg,强连通分量,后缀树,4,0
连通分量由加权图等部分构成,belg,连通分量,加权图,0,5
算法的确定性是多源最短路径的重要属性,b-attr,算法的确定性,多源最短路径,0,7
内存分配是强连通分量的重要属性,attr,强连通分量,内存分配,5,0
邻接矩阵由动态规划等部分构成,belg,邻接矩阵,动态规划,0,5
二叉树包含分割,belg,二叉树,分割,0,5
在外部排序中包含了树表查找,b-belg,树表查找,外部排序,9,1
入度具有查找失败属性,b-attr,查找失败,入度,4,0
在算法中，Θ记号和遍历执行相反的功能,anto,Θ记号,遍历,5,9
查找具有Floyd算法属性,attr,查找,Floyd算法,0,4
动态规划包含顶点度数,b-belg,顶点度数,动态规划,6,0
Kruskal算法表现出外部排序的特性,attr,Kruskal算法,外部排序,0,12
平均查找长度是线段树的重要属性,b-attr,平均查找长度,线段树,0,7
